{
  "contract": "lmdj.project.v2",
  "project_id": "12345678-1234-4123-8123-123456789abc",
  "revision": 7,
  "bpm": 120,
  "banks": [
    {
      "bank": 0,
      "pads": [
        {"pad": 0, "asset_id": "20000000-0000-4000-8000-000000000001", "playback": {"trim_start_frame": 0, "trim_end_frame": null, "trigger_mode": "one_shot", "gain_millidb": -60000, "choke_enabled": false}},
        {"pad": 1, "asset_id": "20000000-0000-4000-8000-000000000001", "playback": {"trim_start_frame": 10, "trim_end_frame": 90, "trigger_mode": "gate", "gain_millidb": 6000, "choke_enabled": true}},
        {"pad": 2, "asset_id": null, "playback": {"trim_start_frame": 0, "trim_end_frame": null, "trigger_mode": "loop_gate", "gain_millidb": 0, "choke_enabled": false}},
        {"pad": 3, "asset_id": null, "playback": {"trim_start_frame": 0, "trim_end_frame": null, "trigger_mode": "loop_toggle", "gain_millidb": 0, "choke_enabled": false}},
        {"pad": 4, "asset_id": null, "playback": {"trim_start_frame": 0, "trim_end_frame": null, "trigger_mode": "one_shot", "gain_millidb": 0, "choke_enabled": false}},
        {"pad": 5, "asset_id": null, "playback": {"trim_start_frame": 0, "trim_end_frame": null, "trigger_mode": "one_shot", "gain_millidb": 0, "choke_enabled": false}},
        {"pad": 6, "asset_id": null, "playback": {"trim_start_frame": 0, "trim_end_frame": null, "trigger_mode": "one_shot", "gain_millidb": 0, "choke_enabled": false}},
        {"pad": 7, "asset_id": null, "playback": {"trim_start_frame": 0, "trim_end_frame": null, "trigger_mode": "one_shot", "gain_millidb": 0, "choke_enabled": false}},
        {"pad": 8, "asset_id": null, "playback": {"trim_start_frame": 0, "trim_end_frame": null, "trigger_mode": "one_shot", "gain_millidb": 0, "choke_enabled": false}},
        {"pad": 9, "asset_id": null, "playback": {"trim_start_frame": 0, "trim_end_frame": null, "trigger_mode": "one_shot", "gain_millidb": 0, "choke_enabled": false}},
        {"pad": 10, "asset_id": null, "playback": {"trim_start_frame": 0, "trim_end_frame": null, "trigger_mode": "one_shot", "gain_millidb": 0, "choke_enabled": false}},
        {"pad": 11, "asset_id": null, "playback": {"trim_start_frame": 0, "trim_end_frame": null, "trigger_mode": "one_shot", "gain_millidb": 0, "choke_enabled": false}},
        {"pad": 12, "asset_id": null, "playback": {"trim_start_frame": 0, "trim_end_frame": null, "trigger_mode": "one_shot", "gain_millidb": 0, "choke_enabled": false}},
        {"pad": 13, "asset_id": null, "playback": {"trim_start_frame": 0, "trim_end_frame": null, "trigger_mode": "one_shot", "gain_millidb": 0, "choke_enabled": false}},
        {"pad": 14, "asset_id": null, "playback": {"trim_start_frame": 0, "trim_end_frame": null, "trigger_mode": "one_shot", "gain_millidb": 0, "choke_enabled": false}},
        {"pad": 15, "asset_id": null, "playback": {"trim_start_frame": 0, "trim_end_frame": null, "trigger_mode": "one_shot", "gain_millidb": 0, "choke_enabled": false}}
      ]
    },
    {
      "bank": 1,
      "pads": [
        {"pad": 0, "asset_id": null, "playback": {"trim_start_frame": 0, "trim_end_frame": null, "trigger_mode": "one_shot", "gain_millidb": 0, "choke_enabled": false}},
        {"pad": 1, "asset_id": null, "playback": {"trim_start_frame": 0, "trim_end_frame": null, "trigger_mode": "one_shot", "gain_millidb": 0, "choke_enabled": false}},
        {"pad": 2, "asset_id": null, "playback": {"trim_start_frame": 0, "trim_end_frame": null, "trigger_mode": "one_shot", "gain_millidb": 0, "choke_enabled": false}},
        {"pad": 3, "asset_id": null, "playback": {"trim_start_frame": 0, "trim_end_frame": null, "trigger_mode": "one_shot", "gain_millidb": 0, "choke_enabled": false}},
        {"pad": 4, "asset_id": null, "playback": {"trim_start_frame": 0, "trim_end_frame": null, "trigger_mode": "one_shot", "gain_millidb": 0, "choke_enabled": false}},
        {"pad": 5, "asset_id": null, "playback": {"trim_start_frame": 0, "trim_end_frame": null, "trigger_mode": "one_shot", "gain_millidb": 0, "choke_enabled": false}},
        {"pad": 6, "asset_id": null, "playback": {"trim_start_frame": 0, "trim_end_frame": null, "trigger_mode": "one_shot", "gain_millidb": 0, "choke_enabled": false}},
        {"pad": 7, "asset_id": null, "playback": {"trim_start_frame": 0, "trim_end_frame": null, "trigger_mode": "one_shot", "gain_millidb": 0, "choke_enabled": false}},
        {"pad": 8, "asset_id": null, "playback": {"trim_start_frame": 0, "trim_end_frame": null, "trigger_mode": "one_shot", "gain_millidb": 0, "choke_enabled": false}},
        {"pad": 9, "asset_id": null, "playback": {"trim_start_frame": 0, "trim_end_frame": null, "trigger_mode": "one_shot", "gain_millidb": 0, "choke_enabled": false}},
        {"pad": 10, "asset_id": null, "playback": {"trim_start_frame": 0, "trim_end_frame": null, "trigger_mode": "one_shot", "gain_millidb": 0, "choke_enabled": false}},
        {"pad": 11, "asset_id": null, "playback": {"trim_start_frame": 0, "trim_end_frame": null, "trigger_mode": "one_shot", "gain_millidb": 0, "choke_enabled": false}},
        {"pad": 12, "asset_id": null, "playback": {"trim_start_frame": 0, "trim_end_frame": null, "trigger_mode": "one_shot", "gain_millidb": 0, "choke_enabled": false}},
        {"pad": 13, "asset_id": null, "playback": {"trim_start_frame": 0, "trim_end_frame": null, "trigger_mode": "one_shot", "gain_millidb": 0, "choke_enabled": false}},
        {"pad": 14, "asset_id": null, "playback": {"trim_start_frame": 0, "trim_end_frame": null, "trigger_mode": "one_shot", "gain_millidb": 0, "choke_enabled": false}},
        {"pad": 15, "asset_id": null, "playback": {"trim_start_frame": 0, "trim_end_frame": null, "trigger_mode": "one_shot", "gain_millidb": 0, "choke_enabled": false}}
      ]
    },
    {
      "bank": 2,
      "pads": [
        {"pad": 0, "asset_id": null, "playback": {"trim_start_frame": 0, "trim_end_frame": null, "trigger_mode": "one_shot", "gain_millidb": 0, "choke_enabled": false}},
        {"pad": 1, "asset_id": null, "playback": {"trim_start_frame": 0, "trim_end_frame": null, "trigger_mode": "one_shot", "gain_millidb": 0, "choke_enabled": false}},
        {"pad": 2, "asset_id": null, "playback": {"trim_start_frame": 0, "trim_end_frame": null, "trigger_mode": "one_shot", "gain_millidb": 0, "choke_enabled": false}},
        {"pad": 3, "asset_id": null, "playback": {"trim_start_frame": 0, "trim_end_frame": null, "trigger_mode": "one_shot", "gain_millidb": 0, "choke_enabled": false}},
        {"pad": 4, "asset_id": null, "playback": {"trim_start_frame": 0, "trim_end_frame": null, "trigger_mode": "one_shot", "gain_millidb": 0, "choke_enabled": false}},
        {"pad": 5, "asset_id": null, "playback": {"trim_start_frame": 0, "trim_end_frame": null, "trigger_mode": "one_shot", "gain_millidb": 0, "choke_enabled": false}},
        {"pad": 6, "asset_id": null, "playback": {"trim_start_frame": 0, "trim_end_frame": null, "trigger_mode": "one_shot", "gain_millidb": 0, "choke_enabled": false}},
        {"pad": 7, "asset_id": null, "playback": {"trim_start_frame": 0, "trim_end_frame": null, "trigger_mode": "one_shot", "gain_millidb": 0, "choke_enabled": false}},
        {"pad": 8, "asset_id": null, "playback": {"trim_start_frame": 0, "trim_end_frame": null, "trigger_mode": "one_shot", "gain_millidb": 0, "choke_enabled": false}},
        {"pad": 9, "asset_id": null, "playback": {"trim_start_frame": 0, "trim_end_frame": null, "trigger_mode": "one_shot", "gain_millidb": 0, "choke_enabled": false}},
        {"pad": 10, "asset_id": null, "playback": {"trim_start_frame": 0, "trim_end_frame": null, "trigger_mode": "one_shot", "gain_millidb": 0, "choke_enabled": false}},
        {"pad": 11, "asset_id": null, "playback": {"trim_start_frame": 0, "trim_end_frame": null, "trigger_mode": "one_shot", "gain_millidb": 0, "choke_enabled": false}},
        {"pad": 12, "asset_id": null, "playback": {"trim_start_frame": 0, "trim_end_frame": null, "trigger_mode": "one_shot", "gain_millidb": 0, "choke_enabled": false}},
        {"pad": 13, "asset_id": null, "playback": {"trim_start_frame": 0, "trim_end_frame": null, "trigger_mode": "one_shot", "gain_millidb": 0, "choke_enabled": false}},
        {"pad": 14, "asset_id": null, "playback": {"trim_start_frame": 0, "trim_end_frame": null, "trigger_mode": "one_shot", "gain_millidb": 0, "choke_enabled": false}},
        {"pad": 15, "asset_id": null, "playback": {"trim_start_frame": 0, "trim_end_frame": null, "trigger_mode": "one_shot", "gain_millidb": 0, "choke_enabled": false}}
      ]
    },
    {
      "bank": 3,
      "pads": [
        {"pad": 0, "asset_id": null, "playback": {"trim_start_frame": 0, "trim_end_frame": null, "trigger_mode": "one_shot", "gain_millidb": 0, "choke_enabled": false}},
        {"pad": 1, "asset_id": null, "playback": {"trim_start_frame": 0, "trim_end_frame": null, "trigger_mode": "one_shot", "gain_millidb": 0, "choke_enabled": false}},
        {"pad": 2, "asset_id": null, "playback": {"trim_start_frame": 0, "trim_end_frame": null, "trigger_mode": "one_shot", "gain_millidb": 0, "choke_enabled": false}},
        {"pad": 3, "asset_id": null, "playback": {"trim_start_frame": 0, "trim_end_frame": null, "trigger_mode": "one_shot", "gain_millidb": 0, "choke_enabled": false}},
        {"pad": 4, "asset_id": null, "playback": {"trim_start_frame": 0, "trim_end_frame": null, "trigger_mode": "one_shot", "gain_millidb": 0, "choke_enabled": false}},
        {"pad": 5, "asset_id": null, "playback": {"trim_start_frame": 0, "trim_end_frame": null, "trigger_mode": "one_shot", "gain_millidb": 0, "choke_enabled": false}},
        {"pad": 6, "asset_id": null, "playback": {"trim_start_frame": 0, "trim_end_frame": null, "trigger_mode": "one_shot", "gain_millidb": 0, "choke_enabled": false}},
        {"pad": 7, "asset_id": null, "playback": {"trim_start_frame": 0, "trim_end_frame": null, "trigger_mode": "one_shot", "gain_millidb": 0, "choke_enabled": false}},